[
  {
    "chapter": "示例章",
    "section": "示例节",
    "topic": "示例考点",
    "questions": [
      {
        "uid": "demo-single-1",
        "q": "下列不属于企业战略特征的是（ ）。",
        "type": "single",
        "o": ["全局性与复杂性", "稳定性与动态性", "长期性与多样性", "收益性与风险性"],
        "a": ["C"],
        "e": "企业战略一般具有全局性与复杂性、稳定性与动态性、收益性与风险性。"
      },
      {
        "uid": "demo-multiple-1",
        "q": "属于企业总体战略业务范畴的有（ ）。",
        "type": "multiple",
        "o": ["稳定经营", "改进单一业务单位竞争地位", "抑制某些业务", "进入新领域", "退出业务并重配资源"],
        "a": ["A", "C", "D", "E"],
        "e": "总体战略涵盖组合稳定、扩张、抑制与退出重配等。"
      }
    ]
  },
  {
    "chapter": "示例章",
    "section": "示例节",
    "topic": "案例题",
    "caseInfo": "甲公司计划进入新行业并收缩旧业务。",
    "questions": [
      {
        "uid": "demo-case-1",
        "q": "根据材料，该公司总体动作更接近（ ）。",
        "type": "single",
        "o": ["维持现状", "业务重组", "单纯降本", "停止经营"],
        "a": ["B"],
        "e": "进入新行业并收缩旧业务属于业务组合调整。"
      }
    ]
  }
]
